film,year,original_comment,augmented_comment,label
Tatami,2023,"Les amies du tatami peuvent se révéler des ennemies. Qu'un film soit aujourd'hui coréalisé par un Israélien et une Iranienne tient du miracle, eu égard à la situation géopolitique et il est évident qu'une telle œuvre ne pourra être vue en Iran que par des voies illégales. Ce qui se trame dans Tatami est non seulement crédible mais a déjà eu lieu,sous une forme voisine, y compris récemment aux J.O de Paris, concernant un autre pays que l'Iran et une autre discipline que le judo. Tourné en grande partie dans un même lieu, un dojo, à l'occasion des championnats du monde de judo. Le film se distingue par son noir et blanc très travaillé et par son scénario haletant où sport et politique se mélangent en un cocktail explosif, au détriment de la liberté d'une athlète et de son entraîneuse. Le lien entre ces deux femmes, de générations différentes, est d'ailleurs l'un des grands points d'intérêt de cette histoire où la judokate est menacée d'Uchi-mata par les autorités de son pays. Le film est puissant et humain, mélodramatique dans le bon sens du terme, où le combat pour le dignité devient un enjeu crucial. Deux petits bémols pour chipoter quand même : les commentaires en voix off des reporters qui couvrent l'événement cèdent parfois au dithyrambique quand ils ne sont pas empreints de naïveté. On aurait pu s'en passer ou tout du moins les rendre moins présents. Enfin, 2 ou trois tours de la compétition sont en trop, si l'on souhaite se conformer à la réalité d'un championnat du monde de judo. Ce ne sont que des détails dans ce réquisitoire puissant contre un régime liberticide, parmi les plus honteux de la planète, et Dieu sait s'il y a de la concurrence en ce domaine.",J. O de Paris souligne la formation voisine dans le tatami où les pairs sont formés. Un athlète critique la participation à l'événement. A envisagé deux ou trois tours dans un même dojo pour faire face à un championnat du monde.,positif
Tatami,2023,"« Tatami », le film coréalisé par Guy Nattiv et Zar Amir Ebrahimi, est un long métrage qui prend d’emblée des partis pris esthétiques auxquels nous ne somme plus trop habitués : le noir et blanc et le format carré. Je ne sais pas pourquoi ils ont fait ce choix mais j’imagine que c’est pour nous offrir un film qui devient de plus en plus étouffant, de plus en plus resserré et tendu au fil des minutes. L’intrigue se déroule presque en temps réel, le temps d’une compétition de judo. On le sait, les combats de judo s’enchainent assez vite dans un championnat, aussi le film n’a que deux angles à exploiter : sur le tatami  et hors du tatami en coulisse (on excepte quelques toutes petites scènes en Iran et quelques flash back très courts). Pour ce qui concerne les scènes de judo, sport très peu exploité à ce jour par le cinéma, je trouve qu’elles sont pas mal filmées du tout. C’est vrai que le sport sur grand écran, c’est souvent compliqué à filmer mais ici ça passe bien. Bien-sur, les effets sonores sont un peu amplifiés, les combats raccourcis, les ippons un peu plus spectaculaires qu’ils ne le sont en réalité. C’est de bonne guerre et pour ce que j’en sais (c’est à dire pas grand-chose étant donné que ce sport m’est peu familier), tout m’a l’air plutôt bien rendu. Mais le suspens n’est pas réellement sur le tatami, il est surtout en coulisse. Peu de musique, un montage au cordeau, des scènes filmées caméra à l’épaule, du hors champs qui fait monter la tension : l’intrigue devient de plus en plus irrespirable au fil des conversations téléphoniques, au point que chaque sonnerie de portable finit par apporter à elle seule de la nervosité au spectateur. Sur la forme, à moins de vouloir chipoter sur les scènes de combat (pour les spécialistes), « Tatami » est de très bonne facture. On en va pas ergoter, le casting repose quasiment entièrement sur deux comédiennes Arienne Mandi dans le rôle de Leila et Zar Amir Ebrahimi elle-même dans le rôle de son entraineuse, Maryam. Cette dernière incarne une ancienne championne spoiler: qui s’est retrouvé en 1988 exactement dans la même situation que sa protégée, et qui a cédé à la pression. Zar Amir Ebrahimi donne corps à une femme tiraillée, spoiler: dont on sent que cela fait longtemps qu’elle ressasse cet abandon. Au début, plus par peur que par loyauté, elle pousse Leïla à accepter, parfois durement, souvent sans ménagement. Mais impossible de lui en vouloir, le régime la place dans une position impossible et elle est terrifiée pour elle-même et ses parents. Plus encore que Leïla, c’est son personnage à elle qui a le plus de chemin à parcourir dans l’espace d’une journée. Arienne Mandi, quant à elle, est formidable dans le rôle de cette femme forte, déterminée spoiler: à ne plus céder à ce régime. Le scénario, d’après ce que je sais, ne raconte pas l’histoire vraie d’une judokate mais mélange plusieurs expériences similaires, subies par des sportifs et des sportives iraniennes dans des sports d’affrontement ces dernières années. C’est arrivé en judo, en lutte, en boxe et surement dans d’autres cas qu’on ignore. Le film montre comment le régime s’y prend pour faire pression : spoiler: on ordonne, puis on menace, puis on va chercher les parents, on leur demande de faire pression, on les arrête le cas échéant, et puis les choses peuvent surement aller encore plus loin, et tellement vite. Leïla commence par refuser mais la pression devient insoutenable, elle perd de l’influx et ses combats sont de plus en plus difficiles. Son quart de finale tourne au cauchemar, elle ne peut plus respirer, elle est proche de l’abandon et dans un geste hautement symbolique, pour retrouver de l’air, elle enlève son foulard. On peut trouver que cette scène symbolique est un peu « facile », que la ficelle est grosse, mais au fond, avec ce geste, elle opère une rupture. La télévision iranienne n’en montrera rien (la retransmission est coupée depuis un moment) mais le geste est là : elle ne le fait pas de rage ou par bravade, elle le fait parce qu’elle a besoin d’air. L’attitude du monde du judo, qui comprends tout assez vite (ils sont habitués malheureusement) et fait tout ce qu’il peut pour aider Leïla, est honorable dans le mesure de leur moyens. On est soulagé lorsque la jeune femme, à bout de nerf, leur demande enfin de l’aide. « Tatami » est un film réussi. On peut (peut-être) trouver à redire sur certains aspects (peut-être) moins crédibles spoiler: (la perte de poids en 20 minutes, la fuite du mari avec son fils en quelques heures) mais pris dans son ensemble, « Tatami » est fort réussi.","Le film, coréalisé par Guy Nattiv et Zar Amir Ebrahimi, est fait de nouvelles versions de ses films. Les personnages jouent des comédiens, des comédiennes et des actors. Un autre film assez dramatique et inhabituel ressemble davantage au judo.",positif
Tatami,2023,Un film puissant et courageux sur les  femmes iraniennes. Une collaboration émouvante entre une Iranienne et un israélien derrière la caméra.,Un film impressionnant sur les femmes iraniennes. La collaboration émouvante derrière la caméra.,positif
Une vie,2023,"À une époque où l'ombre de la guerre menaçait de recouvrir l'Europe, une lueur d'espoir brillait encore dans les ténèbres grâce à des actes de bravoure inimaginables et souvent oubliés. Le film ""Une vie"" nous plonge dans le Prague de 1938, une ville au bord du précipice, sur le point d'être engloutie par la voracité expansionniste du régime nazi. Au cœur de ce récit se trouve Nicholas Winton, un banquier londonien dont la vie bascule dans une mission aussi périlleuse qu'essentielle : sauver des centaines d'enfants juifs promis aux horreurs sans nom des camps de concentration. Ce n'est pas seulement une course contre la montre que retrace le film, mais aussi une profonde introspection sur la capacité de l'humanité à faire preuve de compassion et de courage face à l'inhumanité la plus totale. Winton, avec une détermination qui défie l'entendement, organise des convois vers l'Angleterre, devenant ainsi le phare d'espoir pour 669 âmes innocentes. Ce récit, aussi inspirant qu'émouvant, était resté tapi dans l'ombre de l'histoire, presque oublié, jusqu'à ce qu'une émission britannique en 1988 révèle au monde entier l'ampleur de son héroïsme. ""L'Invisible Héroïsme de Nicholas Winton"" ne se contente pas de narrer les faits ; il nous invite à réfléchir sur la nature de l'héroïsme. Un héroïsme qui ne se mesure pas à l'étalage de la force ou à la recherche de la gloire, mais dans le silence courageux d'actes altruistes. Le film nous confronte à la dure réalité des choix moraux en temps de crise et célèbre la puissance d'un individu à faire une différence monumentale dans la vie des autres. Nicholas Winton n'a jamais cherché la reconnaissance pour ses actes, incarnant ainsi la véritable essence de l'héroïsme : agir non pas pour les louanges, mais parce que c'était la chose juste à faire. Sa rencontre inattendue avec les enfants qu'il a sauvés, devenus adultes, lors de cette émission télévisée de 1988, offre l'un des moments les plus touchants du cinéma récent, un rappel poignant que les véritables héros marchent souvent parmi nous, invisibles.","« un rêve pour 669 enfants innocents », il présente. Le film a été traîné dans l'ombre de l'histoire, presque oublié. Le Banquier londonien a été retrouvé dans une émission télévisée britannique en 1988.",positif
Une vie,2023,"Un film émouvant, éprouvant, qui prend aux tripes - J'ai énormément pleuré à la fin du film car l'émotion était trop forte. On se sent tellement petit et inutile face à des hommes capables de telles actions et surtout qui n'en parleront pas pendant la majeure partie de leur vie.. qui resteront humbles et qui ne se rendront pas compte de ce qu'ils ont fait en  minimisant leurs rôles. A Hopkins est magistral mais l'acteur qui le représente jeune est aussi prodigieux ainsi que l'actrice qui joue sa mère. Pour moi c'est un film extraordinaire  - A ALLER VOIR LE PLUS VITE POSSIBLE",Une pièce éprouvante prend tous les tripes. On se sent tellement petit et inutile face à des hommes qui n'en ont pas eu cette occasion.. qui demeureront humbles.. qui ne se rendront pas compte de ce qu'ils ont fait en minimisant leurs rôles. A plus jeune mais l'acteur qui le représente jeune est aussi prodigieux.,positif
Une vie,2023,"Ce film est un chef d’œuvre! Anthony Hopkins est juste magistral et nous offre une de ses meilleures prestations. Histoire méconnue mais hélas vraie! Très bien réalisé, scénario bien écrit! Courez voir ce film!",Le film a une scène bien écrit.,positif
Une vie,2023,Pour moi ce biopic est un chefs d'œuvre car c'est une histoire méconnu d'un homme qui ce nomme Winton qui va sauver la vie de beaucoup d'enfants le rôle est incarner par l'acteur Anthony Hopkins un acteur que j'aime beaucoup j'ai versé des larmes tellement l'histoire est émouvante un grand merci à cette homme qui va changer l'histoire je vous conseille fortement ce film.,Anthony husley jouera le rôle de jonah qui sauvera la vie d'un homme. 'je vous conseille fortement ce biopic ; vous pouvez le voir sur youtube.,positif
Une vie,2023,"Dieu, s'il existe, a dû considérer qu'un homme tel que Nicholas Winton méritait sans aucun doute de vivre au-delà de ses 100 ans, en récompense d'une existence marquée par des actes héroïques dont il ne s'est jamais vanté. Sauver 669 enfants dans le Prague de 1939, à la veille de la seconde guerre mondiale, lui a valu le surnom de ""Schindler britannique"" et son histoire, celle d'un sauvetage organisé d'innocents menacés par la barbarie, est de celles qui appartiennent au devoir de mémoire, d'autant plus essentiel dans une époque aussi incertaine que la nôtre. Le film alterne  entre 1939 et 1988, de manière un peu lourde d'abord, avant que l'on comprenne la nécessité de ce découpage qui donne toute sa puissance émotionnelle à la scène-clé d'Une vie, qui ne laissera aucun œil sec. Pour autant, le long-métrage sait le plus souvent rester à distance suffisante du pathos, respectant ainsi le caractère foncièrement modeste de ce Juste parmi les nations, même s'il n'a pas obtenu ce titre, du fait de ses origines. Une vie est une œuvre réalisée de manière classique, la mise en scène s'effaçant devant une histoire qui n'a nul besoin d'être enjolivée pour être poignante et, accessoirement, pour ne pas désespérer totalement du genre humain. Anthony Hopkins, sobre, emporte sans problème l'adhésion, au même titre que Johnny Flynn, dans la peau du même personnage, 50 ans plus tôt.","Une vie est une uvre réalisée à titre classique, qui n'a pas besoin d'être enjointe pour être poignante. Anthony Hopkins, sobre, emporte sans problème l'adhésion, dans la peau du même personnage, 50 ans plus tôt.",positif
Le Cercle des neiges,2023,"Le film retrace les 71 jours que les survivants du vol 571 ont passés dans les montagnes en 1972, luttant pour survivre dans un environnement hostile et impitoyable. Ils doivent faire face au froid, à la faim, à la soif, et aux avalanches. Ils doivent également faire des choix difficiles, dont certains les marqueront à jamais. Le Cercle des neiges est un long-métrage captivant et émouvant. La réalisation de Juan Antonio Bayona est impeccable, et les images des Andes sont à couper le souffle. Les acteurs sont tous excellents, et ils parviennent à rendre les personnages complexes et attachants. La musique de Michael Giacchino est également remarquable, contribuant à créer une atmosphère de tension et d'émotion. Le film aborde des thèmes universels, tels que la survie, l'entraide, et la résilience. Il est une réflexion sur la capacité de l'homme à surmonter les épreuves les plus difficiles. A voir sans retenue.","Vol 571 survivants échoués dans les montagnes en 1972. Affectant les difficultés aux avalanches. Les doivent faire face au froid, à la faim, à la soif, aux avalanches.",positif
Le Cercle des neiges,2023,"Le cercle des neiges est déjà la cinquième adaptation cinématographique d'un fait divers qui a stupéfié le monde en 1972 : celui de la survie, en haute altitude, de passagers d'un avion crashé au sommet des Andes. A partir du livre de Pablo Vierci (2009) et d'une documentation que l'on devine la plus exhaustive possible, interviews des survivants comprises, la version réalisée par Juan Antonio Bayona surpasse les films antérieurs, non seulement par son aspect spectaculaire mais surtout par sa vision exacerbée d'une invraisemblable aventure humaine et collective, mystique si l'on veut, qui tente de répondre à la question : que s'est-il passé sur la montagne ? Une tragédie et un miracle, comme cela a été dit à l'époque et aussi, comme le racontait Carlos Paez, l'un des survivants, en 2022 : ""une histoire extraordinaire qui implique des gens ordinaires."" Pas des héros, mais des êtres de chair et de sang, confrontés au choix de l'anthropophagie. Si les scènes de l'accident et des avalanches sont époustouflantes, c'est davantage vers la résistance, la souffrance et le pacte entre les vivants, avec l'acquiescement implicite des morts, qui donnent une âme à un film qui redéfinit les contours du film de survie à une dimension viscérale. Personne d'autre que ses acteurs ne saura jamais ce qu'il s'est réellement passé, là-haut, sur la montagne mais Le cercle des neiges a su, sans nul doute, s'approcher au plus près de la vérité, sans voyeurisme ni recherche du sordide, avec un égal usage de virtuosité et de sobriété, aidé par une troupe de comédiens remarquables.","Les survivants ont été filmés à haute altitude, les passagers d'un avion détruit en 1944. Son adaptation de 1968 est sa cinquième adaptation cinématographique. Le film de 1972 est déjà la 5e de la série annuelle.",positif
Le Cercle des neiges,2023,Peu d'attentes et une énorme claque...je connaissais cette histoire extrêmement bouleversante mais je dois dire que ce film arrive à nous prendre par les tripes avec une force incroyable. Comme pour Killers of the Flower Moon (et d'une certaine façon Oppenheimer) on sort de ce visionnage avec une boule au ventre. Le film est d'une grande beauté avec des plans sur la Cordillère des Andes absolument sublimes. Les acteurs (qui sont pour la plupart uruguayens et peu connus) sont bluffants et ça fait plaisir de voir un film qui priorise la fidélité de l'œuvre en question car oui c'est une histoire vraie. La scène du crash est probablement l'une des plus terrifiantes que j'ai pu voir dans l'histoire du cinéma. Plus immersif que ça c'est difficile...Pour conclure c'est un hommage poignant à ces personnes qui ont vécu l'enfer et à celles et ceux qui n'ont malheureusement pas survécu. Ce film met l'accent sur le côté humain et transpire de réalisme. Quand on sait qu'ils ont tourné sur le véritable lieu du crash ça rajoute un côté poignant à l'oeuvre et ça fait froid dans le dos (sans mauvais jeu de mot). Ce n'est pas un divertissement tout public mais il vaut vraiment le coup d'œil tant il marque les esprits et retranscrit superbement bien cette histoire. L'année 2024 commence d'une magnifique façon.,Les personnages sont légèrement connus de l'uruguay ; n'ont pas de succès. La scène du crash est probablement l'une des plus brûlantes que j'ai pu voir dans l'histoire du cinéma.,positif
Le Cercle des neiges,2023,"WOOOWWW! quelle claque ! J'avais vu ""Les survivants"", excellent film (bien que servi à la sauce hollywoodienne) qui m'avait déjà marquée à l'époque. Mais cette nouvelle adaptation du livre ""La sociedad de la nieve"", écrit par Pablo Vierci, m'a vraiment foutu un choc. Est-ce parce que j'ai vieilli et que je suis plus à même de ressentir la violence de ce qu'ont subi ces personnes, le choc physique et psychologique qu'ils ont dû endurer et l'horrible cruauté de la mort de leurs camarades, amis, familles? Je ne sais pas. Mais j'ai été littéralement été scotchée à mon canapé durant tout le film. La scène du crash m'a été insupportable tant elle est réaliste. J'ai vibré tout du long, pleuré plusieurs fois, et ri au dénouement heureux (du moins pour ceux qui ont survécu...) Il faut le voir.","""Les survivants"", excellent film - bien aimé. L'adaptation du livre ""La sociedad de la nieve"" a été marquée. Le film n'est pas réaliste, mais le film a été scotché à mon canapé par le public.",positif
Le Cercle des neiges,2023,"Netflix est capable du pire comme du meilleur et la c'est le meilleur. Même si l'histoire est vraie elle est filmée avec beaucoup de réalisme. Voir les rescapés entre le courage, abnégation, désespoir, rire, courage, décision difficile qui les a sûrement hanté pendant très longtemps c'est une magnifique leçon. Et puis il y a cette montagne superbe mais tellement dangereuse,des acteurs formidables et une musique de fin sublime et en plus une voix off qui apporte énormément au film. Pour moi en plus d'être un film c'est une leçon de vie. Le film est pressenti pour l'oscar du meilleur film étranger et j'espère qu'il le remportera.",Netflix est capable du pire comme du meilleur et la c'est le meilleur. Le film est pressenti pour l'oscar du meilleur film étranger et j'espère qu'il le remportera.,positif
Les Gardiens de la Galaxie 3,2023,"Je ne m'attendais à pas grand-chose quand je suis allé à l'avant première Des Gardiens de la Galaxie Vol3. Je ne m'attendais pas à avoir un film complet où l'on rit, on pleure, on frissonne dans l'action et la violence, 2H30 que l'on ne sent pas passer avec du grand spectacle. Je m'attendais plus à une pantalonnade avec des personnages faisant les clowns pendant tout le film et j'ai bien senti la claque. James Gunn a pondu un excellent scénario où il a ajouté de la profondeur aux personnages. Je n'avais plus vu autant d'attention aux personnages Marvel depuis Logan. Merci aux acteurs du film d'avoir soutenu James Gunn pour qu'il nous offre ce très bel opus.Cependant, ce film n'est pas un film pour les jeunes enfants, mais les autres vont passer un bon moment. Même si le film était projeté à Disneyland Paris, ce film n'est pas très Disney et c'est cela qui risque de de mitiger son succès auprès d'un large public. On passe de jolies peluches au film d'horreur en quelques minutes avec quelques scènes gore et sadiques. Donc en bref une réussite là où on ne l'attendait pas. Il s'ajoute à la liste des films que je reverrai avec plaisir. Car je suis certain que j'ai raté des choses. Aller le voir en salle  pour profiter du son et des effets spéciaux plein pot.",Cette liste s'ajoute à la liste d'enregistrements de films que je reverrai avec plaisir. Le film est trop prometteur pour répondre à des besoins jeunes comme les naufrages et les familles.,positif
Les Gardiens de la Galaxie 3,2023,"J'avais déjà adoré les deux premiers opus, mais alors là, quel final ! Des personnages toujours aussi attachants, un bon dosage d'humour et d'émotion, ainsi qu'une mise en scène au top. Visuellement, c'est toujours aussi beau. Un troisième opus qui vient clore cette saga avec brio !",Un troisième opus près de clore la saga avec brio !,positif
Les Gardiens de la Galaxie 3,2023,"James Gunn a construit des personnages forts et profonds. Il les a parfaitement exploités dans le 1er film, moins dans le 2ème. Mais surtout, surtout, il a su offrir une fin remarquable à ces héros, une fin émouvante, puissante, et surtout positive. A l'heure où les productions marvels se meurent, James Gunn créé un vrai divertissement de qualité, humaniste et puissant.","Deuxième rôle, moins dans le 1er film, minorités célibataires. James Gunn croit que les personnages profonds, forts et profonds, représentent un divertissement de qualité, humaniste et pouvoir. Il a également développé un divertissement de qualité positive des hommes de guerre des éclosions.",positif
Les Gardiens de la Galaxie 3,2023,"Lancer son film avec la version acoustique de Creep, laisser le titre jouer du début jusqu'à sa fin, est assez audacieux. Si on devait dire une chose du troisième volet de la saga, ce serait la bonne narration et la manière de clôturer l'histoire de Rocket. On en sait davantage et on voit comment il s'est construit. Un gros coup de coeur et une production Nickel !","Le troisième volet de la saga, ce serait la bonne narration et la façon de clôturer l'histoire de Rocket. On en sait davantage et on voit comment il s'est construit.",positif
