film,year,original_comment,augmented_comment,label
The First Slam Dunk,2022,"Takehiko Inoue revient à Slam Dunk, après un hiatus de vingt-sept ans. Le triomphe du manga (170 millions de tomes écoulés à ce jour) lui a donné la liberté choisir ses projets et son rythme de parution. Depuis la fin des années 90, il a deux séries toujours en cours - Vagabond et Real (consacré au handibasket). Pourquoi céder maintenant aux sirènes du film d'animation ? Tout simplement parce qu'il est cette fois-ci aux commandes, contrairement aux précédents métrages produits entre 1994/1995 sans parler de la série animée. Si le projet d'un film a fait plusieurs allers-retours entre Toei animations et Inoue, cela s'expliquait essentiellement par une question de rendu. L'évolution graphique entre le début et la fin du Slam Dunk permet de mesurer à quel point le style de Inoue a mué vers plus de réalisme et d'intensité. Pour lui, hors de question de revenir à l'esthétique rétro et aux couleurs pétantes de l'animé. Très au fait des perspectives offertes par les nouvelles technologies, Inoue aborde The First Slam Dunk comme un nouveau terrain de jeu. Son ambition, il la fixe dès les premières secondes. On devrait siffler le passage en force tellement on se la prend de plein fouet. Inutile d'être un fan de la première heure pour apprécier le spectacle. Inoue a bien compris que le cinéma est une forme d'expression plus directe, moins extensible. Il épure la narration, en éjectant pas mal de gags et de moments suspendus. Le match de basket qui couvre une grosse partie du long-métrage est une claque esthétique. The First Slam Dunk bénéficie de cette communion entre 2D, 3D et motion capture et nous immerge directement sur le terrain. Une pointe de vitesse souffle sur place, un contre est un choc, un rebond devient un moment de pure sidération, et on prend presque les paris sur la prochaine passe. Si vous aimez terminer les rencontres sportives l'estomac noué et la sueur perlant du front, ce film est fait pour vous. Cependant, Inoue n'oublie pas aussi de parler au cœur. Au lieu de tenter une percée hasardeuse vers la suite, le mangaka/réalisateur/scénariste préfère le pas de côté et se concentre sur un second-rôle un peu laissé de côté pour redonner un peu d'air à son univers. Il est toujours question de dépassement de soi et du faire ensemble mais aussi de surmonter sa peine. À travers l'histoire de Ryota, le film peut couvrir un angle inédit et progressivement rassembler toutes les pièces du puzzle sans jamais trahir le manga. Il est évident qu'un fan se sentira plus en phase avec les personnages ou certains tournants dramatiques. D'autant que Inoue fait le choix d'espacer certains flashbacks au risque de déséquilibrer un peu le rythme, et de garder le héros du manga (Sakuragi) et son rival (Rukawa) un peu à distance. Le spectateur néophyte comprendra les relations entre chaque personnage mais pourra éventuellement s'étonner de ne pas avoir plus d'informations concernant certains alors que d'autres ont droit à plus d'égards. La décision est compréhensible mais elle se fait au détriment d'une position d'égalité entre non-connaisseurs et affranchis. Rien qui n'empêche néanmoins de prendre son pied sur ce superbe geste de cinéma. Fans du manga, fans de cinéma, fans de sport, fans d'animation, vous pouvez y aller les yeux bien ouverts. Et au cas où, prière sécher vos larmes en ressortant. Et de respirer un grand coup.","Takehiko Inoue revient à l'écran pour de nouveaux films. Le film est un nouveau terrain de jeu. Inoue associe deux histoires distinctes : le mangaka, le rugbyateur et le héros.",positif
The First Slam Dunk,2022,fan du manga ou de l'anime ou simple amoureux du basket vous allez aimer ce film. courrez le voir tout simplement,"Vous allez aimer ce film en continuant le regard tout simplement simplement. Vous pourrez le voir tout simplement. courtrez le voir tout simplement les savons sur la robe de basket. Vous n'avez qu'à regarder le présent film de ce type, aiguiller le regard sur twitter ou facebook.",positif
The First Slam Dunk,2022,"Un chef-d'œuvre d'animation qui a su synthétiser sur 2h le travail si riche et précis de Takehiko Inoue sur sa pièce maîtresse qu'est Slam Dunk. Les références ne parleront certainement qu'aux connaisseurs du manga, ou au moins de l'anime, mais toute personne appréciant le basket-ball, et le sport de manière générale, ne peut que saluer la performance ici réalisée. Une masterclass à voir absolument.","Takehiko Inoue s'établit sur un travail et précis à l'aide de son animation unique à sampler. Les références ne sont certainement que des connaisseurs du manga, ou au moins de l'anime.",positif
The First Slam Dunk,2022,"""Le basketball arrive à son paroxysme dans un univers que l’on qualifierait pourtant de masculin. Cependant, The First Slam Dunk transcende les individualités du shōnen dont il est adapté, afin de réunir petits et grands, amoureux du manga, du sport ou de cinéma autour d’un plan de jeu unique et une animation à couper le souffle."" ""Les lycéens de Shohoku défient les tenants du titre, une confrontation qui ne laissera personne indemne. Chaque passe et chaque point ont leur importance, que ce soit pour le score final ou pour le moral du groupe. Le duel est à la fois physique et psychologique. Les corps s’adaptent à la vitesse du jeu, mais le bras de fer est permanent. Le positionnement des jambes, des pieds, des mains, des épaules, des hanches… de nombreux réflexes nerveux et abondamment répétés à l’entraînement sont captés dans une animation alléchante, mêlant 2D et 3D, et qui n’oublie pas de justifier la masse des protagonistes à chaque fois qu’ils avancent d’un pas. La mise en scène est d’une minutie qui ravira les fans de cette discipline, à tel point que l’on vit le match et les enjeux de chaque joueur de l’intérieur."" ""« Le match n’est jamais terminé tant que vous n’avez pas abandonné. » Le coach Anzai Mitsuyoshi en sait quelque chose, avec ses années d’expérience au sein de l’équipe nationale. Il est facile de faire le pont avec la vie que les joueurs doivent reprendre en main, qu’importe le camp, qu’importe les ambitions. 26 ans après la fin de la série, The First Slam Dunk de Takehiko Inoue sculpte sa plus grande fresque du basketball sur grand écran, une démonstration savoureuse du savoir-faire de l’animation japonaise. Au terme d’un récit, d’un match et d’une vie sans temps mort, le cinéaste nous tend avec amour et passion le ballon qui nous donne suffisamment envie d’assister à des matchs ou à organiser les nôtres."" Retrouvez ma critique complète sur Le Mag du Ciné.","Takehiko Inoue, de Takehiko Inoue, a conçu un spectacle de basketball stupéfiant.",positif
The First Slam Dunk,2022,"Un drame familial émouvant, un parallèle avec un match de basket réussi tant il montre la résilience et l abnégation. Du suspense et une animation de qualité qui donne envie de regarder des matchs même si on y connaît rien. la bande son est énorme et les personnages tous attachants. peu importe qui gagnera dans le match, c est le spectateur qui s est fait plaisir.",du drame familial émouvant. Un parallèle avec un match de basket réussi tant il montre la résilience et l abnégation. Du suspense et une animation de qualité qui donne envie de regarder des matchs même si on y connaît rien.,positif
Le Chat Potté 2 : la dernière quête,2022,"OUI ! C'est ça qu'on veut ! Une qualité d'écriture de DreamWorks au temps de Shrek, une pépite d'histoire gorgées de nostalgie et d'énormément de référence à différentes œuvres ! Les premières secondes du film mettent déjà en PLS vous êtes fort ! Même les répliques un peu gamines passent tellement inaperçu face à l'énorme qualité d'écriture du scénario ! Des rires, même des moments tristes qui vous laissera pas indifférent !  DreamWorks n'a pas fait une animation pour surfer sur le succès de Shrek en proposant une animation médiocre comme on aurais pu imaginer mais un Chef D'œuvre, ils se sont pas foutu de nous ! On veut des animations comme ça ! J'espère et je pense que ça se refera ! Hâte de voir les prochains opus ! MERCI pour ce chef d'œuvre DreamWorks !","Message de mercurie : des rires, même des moments tristes qui vous laisseront pas indifférents. Eur éternel du spectacle : une pépite",positif
Le Chat Potté 2 : la dernière quête,2022,"Je m'étais un peu lassé du style de Dreamworks Animations ; mais après le film ""Les Bad Guys"", j'avais vraiment kiffé ce renouvellement de faire un mélange entre l'animation américaine et des touches d'animation japonaise. Et j'ai trouvé ce second film sur le Chat Potté excellent bien que le premier reste supérieur mais de peu. Le scénario est assez innovant mais il y a quelques facilités et la mise en image est vraiment très belle. Quand je parle de renouvellement chez ce studio, c'est que globalement, ils tournaient un peu en rond. Et là, c'est le deuxième film qui arrive à me captiver rien qu'avec le visuel. C'est-à-dire qu'on distingue un réel changement : le côté américain est nécessaire avec l'aspect 3D et palpable, les décors sont extrêmement bien détaillés et les personnages sont très bien terminés ; il y a une magnifique texture. Et l'aspect d'animation japonaise se montre dans les mouvements des personnages un peu saccadés et des transitions par des silhouettes ou grâce à des raccords mouvement. Le mélange est vraiment super doux, d'autant plus que la musique donne un beau mixe entre la fantaisie, le grandiose et la telenovela. J'ai vraiment apprécié le scénario, qui est rapidement original mais les péripéties sont un peu trop évidentes et méritent quelque chose de plus réfléchis. Malgré tout, l'histoire est super intéressante et j'ai été attrapé du début jusqu'à la fin. Surtout que les personnages sont très intéressants et ont toujours quelque chose à apporter aux autres personnages, sans pour autant prendre le spectateur pour un idiot. En soi, les propos sont actuels et bien intégrés mais ne sont pas trop didactique ; c'est amené de manière douce et cohérente. Sans compter que l'intégralité des protagonistes sont tous intelligents et ont un chouette développement, et leur évolution est crédible (bien que trop tardive) par rapport à ce qu'on voit. Concrètement, la morale du film se calque parfaitement avec le récit et ses personnages. C'est évident, mais je recommande ce film car, malgré un scénario légèrement trop prévisible, les personnages sont attachants et le tout reste quand même très prenant, surtout que l'animation est incroyable et originale.","Nouveau : le film a un mélange d'animation américaine et japonaise. Nouveau : c'est parfait, car les personnages sont attachants et le tout reste dans le même temps très prenant. Le film est très élégant et émouvant. Il y a une amélioration de la présentation et de la musique qui donnent un mélange parfait. Quelques améliorations pourraient découler d'un changement incendie.",positif
Le Chat Potté 2 : la dernière quête,2022,"Le Chat Potté va être confronté au personnage du Loup qui va pousser très loin les limites du Chat Potté et du spectateur à travers des scènes, parfois très osé, même pour un spectateur adulte, et va causer un véritable traumatisme au Chat Potté qui va entamer une éternelle fuite en avant. C'est un véritable duel entre le temps et le Chat Potté qui s'entame, avec de nombreuses références au Western pour, d'une part, exposer les différents camps qui se battent et se cherchent durant le film, mais aussi pour souligner, avec une forme de fantaisie et d'humour, la tension qu'il y a entre les personnages, en plus de resituer les enjeux intrinsèque du récit (on y reviendra après). Aidé de ses amis, Le Chat Potté participera à un immense battle royale où les figures du conte se tapent dessus sans retenu avec des chorégraphies spectaculaires et impressionnantes qui laissent rêveur. Malgré des soucis technique récurent aux films d'animation récent comme un sentiment de frame en moins lorsque l'image est bourré d'élément en mouvement, le film est magnifiquement bien réalisé, avec des graphismes au top et une direction artistique impeccable. Les musiques sont fortes, et surtout, on a un soin particulier aux tableaux et à la photographie. Le film se veut presque comme un complément au film des Bad Guys tant le film dresse en sous texte le même constat méta sur DreamWorks. Quoi de plus représentatif de DreamWorks que la licence Shrek et de son célèbre Chat Potté. A l'image du studio et des Bad Guys, le Chat Potté a connu une période de gloire qu'il aime se remémorer, mais c'est aussi un héros qui est connu extrêmement bas car voulant trop coller au style Disney. On le voit notamment dans sa scène d'ouverture qui cite Coco de Lee Unkrich et Adrian Molina et sa scène de chant à la guitare dans la maison de De La Cruz, avec un Chat Potté qui imite Miguel en lui rendant hommage sans vraiment s'en rendre compte. Le film, tout comme le studio, se veut comme une introspection qui juge les actions de son personnage principale par rapport à une traversé du désert qui lui sera éprouvante, mais bénéfique. La clef qui aidera le Chat Potté (et DreamWorks par la même occasion) à grandir résidera au fait de revenir à la source de ce qui a fait sa splendeur, et de s'entourer de personnes de confiances. J'en ai pas nécessairement parlé en détail, mais le Chat Potté aura besoin d'aide dans sa quête de reconstruction, que cela soit des alliés qu'il faudra convaincre après les avoir une première fois déçu, ou encore un témoin extérieur. Le Chat Potté 2: La dernière quête est un très beau film, à la réflexion maligne, à l'exécution remarquable, et vous l'aurez très vite compris, c'est un immense coup de cœur personnel qui me conforte dans l'idée que DreamWorks vit un renouveau créatif et artistique remarquable. En espérant que cet élan pourra se préserver à l'avenir, mais pour l'instant, je reste rêveur face à tant de maitrise, car je pense avoir vu un très grand film qu'il me sera très difficile d'oublier. 18/20 N’hésitez pas à partager votre avis et le défendre, qu'il soit objectif ou non. De mon côté, je le respecterai s'il est en désaccord avec le miens, mais je le respecterai encore plus si vous, de votre côté, vous respectez mon avis.","Le film est aussi brillant que le studio et les Bad Guys. Selon le réalisateur, il y a un énorme coup de cur qui l'aide. Le Chat Potté se bat dans un immense bataille royale où les personnages du personnage principal du jeu empruntent dessus sans tirer compte.",positif
Le Chat Potté 2 : la dernière quête,2022,"Je dois dire que cela fait du bien ! Dans toute cette masse de productions fades et délavées de films ou films d'animation que l'on nous sert sans discontinuer, enfin un qui sort du lot ! Ce film d'animation est purement travaillé du début à la fin. L'animation est un régal pour les yeux ! Le partit pris sors de l'ordinaire et est réussi à merveille. Le visuel entre la peinture et le rendu 3d de qualité est juste un pur bonheur pour les yeux. Certains plans nous laissent le doute si ils n'ont pas été peints par un artiste et non rendu sur ordinateur tellement ils sont beaux, fins et travaillés ! L'histoire est excellente également, enfin un scénario bien réglé qui part pas dans tout les sens avec 50 personnages pour rien ! Très peu voir aucunes lenteurs on se régale de bout en bout de suivre ce récit qui fait évoluer les personnages telle une quête. Les personnages quand a eux sont travaillés et une identité propre très forte qui les rend attachants. Même pour le loup qui sans spoil est impressionnant et l'on ressent bien sa force. Les décors sont somptueux, encore une fois digne de magnifique peintures d'artistes. Et pour finir, en plus de l'histoire, la morale ! Oui comme les anciens contes, ce film nous apporte une vrai morale qui fait réfléchir et intéressante/importante et réellement touchante. On sort de ce film avec une sensation d'avoir vu un très bon film qu'on irait revoir avec joie ! Je vous recommande vraiment d'aller le voir, vous ne regretterez pas, il est exceptionnel !",Cinematic Universe et films d'animation est un grand succès. Les performances sont stupéfiantes et le rendu 3d est parfait. Certains pensent que le film n'a pas été peint par un artiste et non rendu sur ordinateur.,positif
Le Chat Potté 2 : la dernière quête,2022,"Après un premier opus cinématographique que j'avais trouvé juste mignonnet, ce Chat Potté 2 est une excellente surprise, bourré de trouvailles tant graphiques que drôles. Notre majestueux et fier matou est malmené comme jamais, on l'en aime encore plus à la fin.","Chat Potté 2 est un excellente surprise, bourré de trouvailles tant graphiques que drôles. On l'espère encore plus à la fin.",positif
Babylon,2022,"Babylon Dans ce film tous les acteurs sont exceptionnels et s’arrêter sur Brad Pitt et Margot Robbie serait réducteur. D’autant plus que d’une certaine façon, leur histoire est vue à travers les yeux du personnage joué par Diego Calva, que je découvre dans ce film. Histoire, lumières, effets visuels, rythme, BO, choix et jeu des comédiens…  tout est parfaitement réussi ! Les 3 heures passent comme un claquement de doigts. Certains seront peut-être choqués par les scènes de débauche et d’orgie et d’autres par des scènes un peu glauques, je pense, par exemple, au serpent et au rat (ceux qui ont vu le film comprendront) Ce n’est pas pour rien qu’il est interdit aux moins de 12 ans ! S’il y a des scènes dramatiques, il y a aussi, pas mal d’humour. Et oui j’ai pas mal rigolé. Alors ça raconte l’histoire de la création d’Hollywood et pour les acteurs, les techniciens et les réalisateurs, le passage du muet au parlant. Pour les comédiens, c’est un tout autre métier. Tout à coup, il faut apprendre un texte par cœur, savoir poser sa voix et l’avoir agréable à l’oreille et plutôt que d’accentuer des mimiques pour faire passer les émotions, se servir de sa voix et la moduler comme il se doit. Je ne sais pas si toute la salle du cinéma dans laquelle je me trouvais, était conquise, mais le film s’est achevé sous les applaudissements. Et ça faisait longtemps que je n’avais pas entendu une salle applaudir. Pour moi ce film est le premier chef d'œuvre de l’année 2023. A voir absolument !","En 2023, c'est le premier chef d'uvre de haute technologie. C'est un film à apprendre et à maîtriser les habitudes de l'improvisation. Il y a une scène dramatique, une histoire de la création d'Hollywood.",positif
Babylon,2022,"Chef d'oeuvre ! Un ovni ....  c'est cru , c'est violent , c'est cash , c'est beau , c'est triste .. il a tout. Une mise en scène juste incroyable et des acteurs d'exception ( mention spéciale à Margot Robbie ) . Une ode au cinéma au vitriol.",Margot Robbie. Une ode au cinéma au vitriol n'est que la dernière des ensembles de la mise en scène juste incroyable.,positif
Babylon,2022,"Une œuvre incomprise, je suis sorti de la salle complètement reconnaissant et gracieux envers Damien Chazelle qui nous a parfaitement illustré les clichés du cinema hollywoodien des années 30, et de nous avoir fait vivre la folie de ces stars. Immense travail sur les chorégraphies, les décors et surtout quel jeu d'acteur... Margot Robbie au sommet de son art... un humour bien travaillé et beaucoup de références calées. La fin du film est très émotionnelle et nous montre la beauté du cinéma à travers les époques. Un film absolument à voir au cinéma pour profiter pleinement de la musique pour une meilleure immersion dans le film.",Démonstrations et décors en grande partie exemplaires. Un humour bien travaillé et beaucoup de références calées. La fin du film est très émotionnelle.,positif
Babylon,2022,"Nouvelle réalisation de Damien Chazelle que j'attendais beaucoup et qui ne m'a absolument pas déçu. Je précise que chaque film de Chazelle est pour moi une grande réussite (Whiplash, LaLa Land, First Man). Il arrive toujours à me transporter dans les lieux et l'époque qu'il traite. Entre Once upon a time in Hollywood pour son hommage à Hollywood et au Loup de Wall Street pour sa folie, Babylon est une fresque magnifique et délirante sur le cinéma hollywoodien des 20's, quelque peu fantasmé cela dit. Les anachronismes, notamment sur les danses, sont finalement là pour nous faire saisir, à travers nos codes actuels, de la folie d'une époque. Superbe BO (récompensée aux Globes), superbe photographie, super montage, superbes décors et costumes,...Grâce aussi à la réalisation de Chazelle qui m'éblouit encore et aux prestations des acteurs/trices qui se lâchent dans des rôles bien développés, on passe les 2/3 du film sans jamais s'ennuyer, transporté dans ce monde hors du temps. L'humour aussi fonctionne bien aussi, le montage aidant. Cependant, la dernière heure dispose d'un rythme moins effréné et des scènes un peu trop étirées en longueur à certains moments et moins impressionnantes que dans les 2 premières heures. La fin est pour moi un peu trop fermée, me laissant penser que le film aurait pu faire 15 min de moins sans que notre ressenti en soit impacté. Mais au vu des nombreuses scènes marquantes et mon ressenti global sur le film, je ne peux que conseiller d'aller voir Babylon au cinéma !","Finale terminée dans la salle des salles de cinéma hollywoodiennes des 20's. Iconic, grande réalisation et super animation de la part de Damien Chazelle. Plus tard encore, le film est un succès pour moi. Le photographe et le montage n'ont pas été améliorés, et il obtient un approbation constant de la part des audiences.",positif
